{
  "id": "intent-03",
  "pair_id": "amount-count",
  "split": "test",
  "source_family": "finance-manual-v1",
  "question": "2013 年第二季度的总交易额是多少？",
  "reference_time": "2013-07-15T10:00:00+08:00",
  "timezone": "Asia/Shanghai",
  "annotation": {
    "metric_mentions": ["总交易额"],
    "groups": [],
    "filters": [],
    "time_mentions": ["2013 年第二季度"]
  },
  "expected": {
    "candidates_include": ["total_trade_value"],
    "reason_code": "bound",
    "unresolved_slots": [],
    "plan": {
      "metric": "total_trade_value",
      "dimensions": [],
      "time": {"granularity": "quarter", "value": "2013Q2"},
      "filters": [],
      "order_by": [],
      "limit": 100
    }
  }
}
