{
  "id": "intent-01",
  "pair_id": "include-exclude",
  "split": "test",
  "source_family": "finance-manual-v1",
  "question": "只看分支 IEMJHuQgCPDHCwwJkgQQeaqGvzMcVD 的 2013 年佣金收入是多少？",
  "reference_time": "2013-07-15T10:00:00+08:00",
  "timezone": "Asia/Shanghai",
  "annotation": {
    "metric_mentions": ["佣金收入"],
    "groups": [],
    "filters": [
      {
        "subject": "分支",
        "op": "eq",
        "values": ["IEMJHuQgCPDHCwwJkgQQeaqGvzMcVD"]
      }
    ],
    "time_mentions": ["2013 年"]
  },
  "expected": {
    "candidates_include": ["commission_revenue"],
    "reason_code": "bound",
    "unresolved_slots": [],
    "plan": {
      "metric": "commission_revenue",
      "dimensions": [],
      "time": {"granularity": "year", "value": 2013},
      "filters": [
        {"column": "Branch", "op": "=", "value": "IEMJHuQgCPDHCwwJkgQQeaqGvzMcVD"}
      ],
      "order_by": [],
      "limit": 100
    }
  }
}
