{
  "id": "intent-06",
  "pair_id": "group-filter",
  "split": "test",
  "source_family": "finance-manual-v1",
  "question": "2013 年第二季度交易所 NASDAQ 的佣金收入是多少？",
  "reference_time": "2013-07-15T10:00:00+08:00",
  "timezone": "Asia/Shanghai",
  "annotation": {
    "metric_mentions": ["佣金收入"],
    "groups": [],
    "filters": [
      {
        "subject": "交易所",
        "op": "eq",
        "values": ["NASDAQ"]
      }
    ],
    "time_mentions": ["2013 年第二季度"]
  },
  "expected": {
    "candidates_include": ["commission_revenue"],
    "reason_code": "bound",
    "unresolved_slots": [],
    "plan": {
      "metric": "commission_revenue",
      "dimensions": [],
      "time": {"granularity": "quarter", "value": "2013Q2"},
      "filters": [
        {"column": "ExchangeID", "op": "=", "value": "NASDAQ"}
      ],
      "order_by": [],
      "limit": 100
    }
  }
}
